{
  "schemaVersion": 1,
  "contentRevision": "ws-content-r1",
  "domain": "days",
  "dataRevision": "day-d01-d20-r1",
  "metadata": {
    "baseline": "3P_EASY_STANDARD",
    "expUnit": "PER_REGISTERED_PLAYER",
    "resourceGroupsDay01To10": ["construction", "survival", "metal", "signal", "corruption"],
    "resourceGroupsDay11To20": ["construction", "survival", "metal", "signal", "bio"]
  },
  "entries": [
    {"id":"DAY-01","day":1,"threatProfile":"INTRO","exp":{"progress":80,"activity":30,"cumulative":110},"levelEnd":{"level":2,"current":10,"next":130},"resourceBudget":{"groups":[57,22,8,0,0],"sources":{"gathering":[42,16,5,0,0],"node":[10,4,3,0,0],"event":[3,2,0,0,0],"combat":[2,0,0,0,0]}},"encounterRef":"ENC-D01"},
    {"id":"DAY-02","day":2,"threatProfile":"INTRO","exp":{"progress":80,"activity":30,"cumulative":220},"levelEnd":{"level":2,"current":120,"next":130},"resourceBudget":{"groups":[50,23,12,0,0],"sources":{"gathering":[35,15,7,0,0],"node":[8,4,3,0,0],"event":[4,3,1,0,0],"combat":[3,1,1,0,0]}},"encounterRef":"ENC-D02"},
    {"id":"DAY-03","day":3,"threatProfile":"INTRO","exp":{"progress":140,"activity":60,"cumulative":420},"levelEnd":{"level":4,"current":20,"next":220},"augmentMilestone":{"level":3,"tier":"SILVER","scope":"PERSONAL"},"resourceBudget":{"groups":[44,21,13,0,0],"sources":{"gathering":[30,13,7,0,0],"node":[7,3,3,0,0],"event":[4,3,1,0,0],"combat":[3,2,2,0,0]}},"encounterRef":"ENC-D03"},
    {"id":"DAY-04","day":4,"threatProfile":"PRESSURE","exp":{"progress":150,"activity":60,"cumulative":630},"levelEnd":{"level":5,"current":10,"next":280},"resourceBudget":{"groups":[41,20,18,4,0],"sources":{"gathering":[26,12,8,0,0],"node":[7,3,5,2,0],"event":[5,3,3,1,0],"combat":[3,2,2,1,0]}},"encounterRef":"ENC-D04"},
    {"id":"DAY-05","day":5,"threatProfile":"PRESSURE","exp":{"progress":180,"activity":80,"cumulative":890},"levelEnd":{"level":5,"current":270,"next":280},"resourceBudget":{"groups":[38,20,24,5,1],"sources":{"gathering":[23,11,10,0,0],"node":[7,3,6,2,0],"event":[5,3,4,2,1],"combat":[3,3,4,1,0]}},"encounterRef":"ENC-D05"},
    {"id":"DAY-06","day":6,"threatProfile":"ADAPT","exp":{"progress":230,"activity":110,"cumulative":1230},"levelEnd":{"level":6,"current":330,"next":350},"augmentMilestone":{"level":6,"tier":"GOLD","scope":"PERSONAL"},"resourceBudget":{"groups":[35,19,27,8,3],"sources":{"gathering":[20,10,10,1,0],"node":[7,3,8,3,1],"event":[5,3,5,3,2],"combat":[3,3,4,1,0]}},"encounterRef":"ENC-D06"},
    {"id":"DAY-07","day":7,"threatProfile":"ADAPT","exp":{"progress":215,"activity":85,"cumulative":1530},"levelEnd":{"level":7,"current":280,"next":430},"resourceBudget":{"groups":[34,19,28,9,4],"sources":{"gathering":[19,10,10,1,0],"node":[7,3,8,3,1],"event":[5,3,5,4,2],"combat":[3,3,5,1,1]}},"encounterRef":"ENC-D07"},
    {"id":"DAY-08","day":8,"threatProfile":"ELITE_SIGNAL","exp":{"progress":240,"activity":110,"cumulative":1880},"levelEnd":{"level":8,"current":200,"next":520},"resourceBudget":{"groups":[32,19,28,10,6],"sources":{"gathering":[17,9,9,1,0],"node":[7,3,8,4,2],"event":[5,3,5,3,2],"combat":[3,4,6,2,2]}},"encounterRef":"ENC-D08"},
    {"id":"DAY-09","day":9,"threatProfile":"ELITE_SIGNAL","exp":{"progress":275,"activity":145,"cumulative":2300},"levelEnd":{"level":9,"current":100,"next":620},"resourceBudget":{"groups":[31,18,28,12,7],"sources":{"gathering":[16,8,8,2,0],"node":[7,3,8,4,2],"event":[5,3,5,4,2],"combat":[3,4,7,2,3]}},"encounterRef":"ENC-D09"},
    {"id":"DAY-10","day":10,"threatProfile":"BOSS_DAY","exp":{"progress":384,"activity":136,"cumulative":2820},"levelEnd":{"level":10,"current":0,"next":730},"augmentMilestones":[{"level":10,"tier":"PRISM","scope":"PERSONAL"},{"day":10,"scope":"PARTY","selectionIndex":1}],"resourceBudget":{"groups":[21,18,20,9,4]},"bossRef":"BOSS-D10-RESONANT-PURSUER"},
    {"id":"DAY-11","day":11,"threatProfile":"STATUS_INTRO","exp":{"progress":595,"activity":255,"cumulative":3670},"levelEnd":{"level":11,"current":120,"next":850},"resourceBudget":{"groups":[32,22,25,10,10],"sources":{"gathering":[18,10,10,2,2],"node":[6,4,6,3,3],"event":[5,4,4,3,3],"combat":[3,4,5,2,2]}}},
    {"id":"DAY-12","day":12,"threatProfile":"STATUS_INTRO","exp":{"progress":665,"activity":285,"cumulative":4620},"levelEnd":{"level":12,"current":220,"next":980},"resourceBudget":{"groups":[31,23,27,11,15],"sources":{"gathering":[17,10,11,2,3],"node":[6,4,6,3,4],"event":[5,4,5,3,4],"combat":[3,5,5,3,4]}}},
    {"id":"DAY-13","day":13,"threatProfile":"STATUS_CHAIN","exp":{"progress":735,"activity":315,"cumulative":5670},"levelEnd":{"level":13,"current":290,"next":1120},"resourceBudget":{"groups":[30,24,29,12,20],"sources":{"gathering":[16,10,11,2,4],"node":[6,4,7,4,5],"event":[5,5,5,3,5],"combat":[3,5,6,3,6]}}},
    {"id":"DAY-14","day":14,"threatProfile":"STATUS_CHAIN","exp":{"progress":805,"activity":345,"cumulative":6820},"levelEnd":{"level":14,"current":320,"next":1270},"resourceBudget":{"groups":[29,25,30,13,24],"sources":{"gathering":[15,10,11,2,4],"node":[6,4,7,4,6],"event":[5,5,6,4,7],"combat":[3,6,6,3,7]}}},
    {"id":"DAY-15","day":15,"threatProfile":"AUGMENT_ADAPT","exp":{"progress":875,"activity":375,"cumulative":8070},"levelEnd":{"level":15,"current":300,"next":1430},"augmentMilestone":{"level":15,"tierRoll":{"SILVER":0.50,"GOLD":0.30,"PRISM":0.20},"lock":"FIRST_PLAYER_PER_RUN","scope":"PERSONAL_AND_ENEMY"},"resourceBudget":{"groups":[28,25,31,14,29],"sources":{"gathering":[14,10,11,2,5],"node":[6,4,8,4,7],"event":[5,5,6,4,8],"combat":[3,6,6,4,9]}}},
    {"id":"DAY-16","day":16,"threatProfile":"AUGMENT_ADAPT","exp":{"progress":945,"activity":405,"cumulative":9420},"levelEnd":{"level":16,"current":220,"next":1600},"resourceBudget":{"groups":[27,26,32,15,33],"sources":{"gathering":[13,10,11,3,5],"node":[6,4,8,4,8],"event":[5,5,6,4,9],"combat":[3,7,7,4,11]}}},
    {"id":"DAY-17","day":17,"threatProfile":"AUGMENT_ADAPT","exp":{"progress":1015,"activity":435,"cumulative":10870},"levelEnd":{"level":17,"current":70,"next":1780},"resourceBudget":{"groups":[26,27,33,16,36],"sources":{"gathering":[12,10,11,3,5],"node":[6,5,8,4,9],"event":[5,5,7,5,10],"combat":[3,7,7,4,12]}}},
    {"id":"DAY-18","day":18,"threatProfile":"ELITE_STATUS","exp":{"progress":1120,"activity":480,"cumulative":12470},"levelEnd":{"level":17,"current":1670,"next":1780},"resourceBudget":{"groups":[25,28,34,17,43],"sources":{"gathering":[11,10,11,3,6],"node":[6,5,8,5,10],"event":[5,6,7,5,12],"combat":[3,7,8,4,15]}}},
    {"id":"DAY-19","day":19,"threatProfile":"ELITE_STATUS","exp":{"progress":1225,"activity":525,"cumulative":14220},"levelEnd":{"level":18,"current":1640,"next":1970},"resourceBudget":{"groups":[24,29,35,18,47],"sources":{"gathering":[10,10,11,3,6],"node":[6,5,9,5,11],"event":[5,6,7,5,13],"combat":[3,8,8,5,17]}}},
    {"id":"DAY-20","day":20,"threatProfile":"STATUS_BOSS_DAY","exp":{"progress":1750,"activity":750,"cumulative":16720},"levelEnd":{"level":20,"current":0,"next":2380},"augmentMilestones":[{"level":20,"tierRoll":{"SILVER":0.50,"GOLD":0.30,"PRISM":0.20},"lock":"FIRST_PLAYER_PER_RUN","scope":"PERSONAL_AND_ENEMY"},{"day":20,"scope":"PARTY","selectionIndex":2}],"resourceBudget":{"groups":[20,28,30,16,44],"sources":{"gathering":[8,9,9,2,5],"node":[5,5,7,5,10],"event":[4,6,6,4,12],"combat":[3,8,8,5,17]}},"bossRef":"BOSS-D20-NEURAL-AMALGAM"}
  ]
}
